{
  "$schema": "https://json-schema.org/draft/2020-12/schema",
  "$id": "https://schemas.agent-ix.org/agent-ix/spec-artifacts-process/SpecReview.json",
  "type": "object",
  "properties": {
    "id": {
      "$ref": "https://schemas.agent-ix.org/agent-ix/spec-artifacts-process/UpperDocId.json"
    },
    "title": {
      "$ref": "https://schemas.agent-ix.org/agent-ix/spec-artifacts-process/NonEmptyText.json"
    },
    "type": {
      "type": "string",
      "const": "SpecReview"
    },
    "analysis": {
      "$ref": "https://schemas.agent-ix.org/agent-ix/spec-artifacts-process/AnalysisKind.json"
    },
    "scope": {
      "type": "array",
      "items": {
        "$ref": "https://schemas.agent-ix.org/agent-ix/spec-artifacts-process/NonEmptyText.json"
      },
      "description": "The spec paths or ids reviewed, one entry per authored path."
    },
    "reviewSet": {
      "$ref": "https://schemas.agent-ix.org/agent-ix/spec-artifacts-process/ReviewSet.json"
    },
    "object": {
      "$ref": "https://schemas.agent-ix.org/agent-ix/spec-artifacts-process/ObjectTypeName.json"
    },
    "relationships": {
      "type": "array",
      "items": {
        "$ref": "https://schemas.agent-ix.org/agent-ix/spec-artifacts-process/Relationship.json"
      },
      "description": "Absent when the author declared none; the frontmatter schemas do not require the key, and the model must not require what the schema does not (FR-011-AC-15)."
    },
    "provenance": {
      "$ref": "https://schemas.agent-ix.org/agent-ix/spec-artifacts-process/Provenance.json"
    },
    "summary": {
      "$ref": "https://schemas.agent-ix.org/agent-ix/spec-artifacts-process/Section.json"
    },
    "findings": {
      "type": "array",
      "items": {
        "$ref": "https://schemas.agent-ix.org/agent-ix/spec-artifacts-process/FindingRow.json"
      },
      "minItems": 1
    }
  },
  "required": [
    "id",
    "title",
    "type",
    "provenance",
    "summary",
    "findings"
  ],
  "unevaluatedProperties": {
    "not": {}
  },
  "description": "Validated per-analysis review record (archetype `SpecReview`). One document\nper analysis skill. The findings stay queryable from the review that raised\nthem and grounded in the artifacts they name (FR-013)."
}
